[
  {
    "ingredient_id": "vitamin_a_preformed",
    "ingredient_name_ko": "비타민 A(프리폼드)",
    "ingredient_name_en": "Vitamin A (preformed)",
    "category": "vitamin",
    "forms": [
      "retinol",
      "retinyl palmitate",
      "retinyl acetate",
      "retinyl esters"
    ],
    "matching_aliases_ko": [
      "비타민A",
      "레티놀",
      "레티닐팔미테이트",
      "레티닐아세테이트",
      "프리폼드 비타민A"
    ],
    "matching_aliases_en": [
      "vitamin a",
      "retinol",
      "retinyl palmitate",
      "retinyl acetate",
      "preformed vitamin a"
    ],
    "quality_notes_ko": "UL은 프리폼드 vitamin A에만 적용. beta-carotene과 분리 매칭 필요."
  },
  {
    "ingredient_id": "beta_carotene",
    "ingredient_name_ko": "베타카로틴",
    "ingredient_name_en": "Beta-carotene",
    "category": "carotenoid",
    "forms": [
      "beta-carotene",
      "provitamin A carotenoid"
    ],
    "matching_aliases_ko": [
      "베타카로틴",
      "β-카로틴",
      "프로비타민A"
    ],
    "matching_aliases_en": [
      "beta-carotene",
      "provitamin a carotenoid"
    ],
    "quality_notes_ko": "흡연력/석면노출 여부를 별도 사용자 필드로 보관 권장."
  },
  {
    "ingredient_id": "vitamin_d",
    "ingredient_name_ko": "비타민 D",
    "ingredient_name_en": "Vitamin D",
    "category": "vitamin",
    "forms": [
      "cholecalciferol",
      "ergocalciferol",
      "calcidiol"
    ],
    "matching_aliases_ko": [
      "비타민D",
      "콜레칼시페롤",
      "에르고칼시페롤",
      "칼시디올"
    ],
    "matching_aliases_en": [
      "vitamin d",
      "cholecalciferol",
      "ergocalciferol",
      "calcidiol"
    ],
    "quality_notes_ko": "단위 변환(IU↔mcg) 필요. 1 mcg = 40 IU."
  },
  {
    "ingredient_id": "calcium",
    "ingredient_name_ko": "칼슘",
    "ingredient_name_en": "Calcium",
    "category": "mineral",
    "forms": [
      "calcium carbonate",
      "calcium citrate",
      "elemental calcium"
    ],
    "matching_aliases_ko": [
      "칼슘",
      "탄산칼슘",
      "구연산칼슘",
      "원소칼슘"
    ],
    "matching_aliases_en": [
      "calcium",
      "calcium carbonate",
      "calcium citrate",
      "elemental calcium"
    ],
    "quality_notes_ko": "제형별 원소칼슘 환산 필요."
  },
  {
    "ingredient_id": "magnesium_supplement",
    "ingredient_name_ko": "마그네슘(보충제)",
    "ingredient_name_en": "Magnesium (supplemental)",
    "category": "mineral",
    "forms": [
      "magnesium oxide",
      "magnesium citrate",
      "magnesium glycinate",
      "magnesium salts"
    ],
    "matching_aliases_ko": [
      "마그네슘",
      "산화마그네슘",
      "구연산마그네슘",
      "글리시네이트 마그네슘"
    ],
    "matching_aliases_en": [
      "magnesium",
      "magnesium oxide",
      "magnesium citrate",
      "magnesium glycinate"
    ],
    "quality_notes_ko": "UL은 음식 전체가 아니라 보충제/의약품 유래 마그네슘에 적용."
  },
  {
    "ingredient_id": "iron",
    "ingredient_name_ko": "철",
    "ingredient_name_en": "Iron",
    "category": "mineral",
    "forms": [
      "ferrous sulfate",
      "ferrous gluconate",
      "ferric iron",
      "heme iron"
    ],
    "matching_aliases_ko": [
      "철",
      "철분",
      "황산제일철",
      "푸마르산제일철",
      "글루콘산제일철"
    ],
    "matching_aliases_en": [
      "iron",
      "ferrous sulfate",
      "ferrous gluconate",
      "ferric iron",
      "heme iron"
    ],
    "quality_notes_ko": "원소철 기준으로 통일 권장."
  },
  {
    "ingredient_id": "folic_acid",
    "ingredient_name_ko": "엽산(합성 folate)",
    "ingredient_name_en": "Folic acid / synthetic folate",
    "category": "vitamin",
    "forms": [
      "folic acid",
      "5-MTHF",
      "folate from fortified foods"
    ],
    "matching_aliases_ko": [
      "엽산",
      "폴산",
      "합성 엽산",
      "5-MTHF"
    ],
    "matching_aliases_en": [
      "folic acid",
      "folate",
      "5-MTHF",
      "synthetic folate"
    ],
    "quality_notes_ko": "UL은 자연식품 folate가 아니라 supplements/fortified foods의 folate에 적용."
  },
  {
    "ingredient_id": "vitamin_k",
    "ingredient_name_ko": "비타민 K",
    "ingredient_name_en": "Vitamin K",
    "category": "vitamin",
    "forms": [
      "phylloquinone",
      "menaquinone",
      "vitamin K1",
      "vitamin K2"
    ],
    "matching_aliases_ko": [
      "비타민K",
      "필로퀴논",
      "메나퀴논",
      "비타민K1",
      "비타민K2",
      "MK-7"
    ],
    "matching_aliases_en": [
      "vitamin k",
      "phylloquinone",
      "menaquinone",
      "vitamin k1",
      "vitamin k2",
      "mk-7"
    ],
    "quality_notes_ko": "warfarin류와는 일관성(consistency) 규칙이 핵심."
  },
  {
    "ingredient_id": "omega3_epa_dha",
    "ingredient_name_ko": "오메가-3(EPA+DHA)",
    "ingredient_name_en": "Omega-3 (EPA+DHA)",
    "category": "fatty_acid",
    "forms": [
      "EPA",
      "DHA",
      "fish oil",
      "icosapent ethyl"
    ],
    "matching_aliases_ko": [
      "오메가3",
      "EPA",
      "DHA",
      "피쉬오일",
      "어유",
      "이코사펜트에틸"
    ],
    "matching_aliases_en": [
      "omega-3",
      "epa",
      "dha",
      "fish oil",
      "icosapent ethyl"
    ],
    "quality_notes_ko": "EPA, DHA, EPA+DHA 합산 mg/day를 별도 계산 필요."
  },
  {
    "ingredient_id": "zinc",
    "ingredient_name_ko": "아연",
    "ingredient_name_en": "Zinc",
    "category": "mineral",
    "forms": [
      "zinc sulfate",
      "zinc gluconate",
      "zinc acetate"
    ],
    "matching_aliases_ko": [
      "아연",
      "황산아연",
      "글루콘산아연",
      "아세트산아연"
    ],
    "matching_aliases_en": [
      "zinc",
      "zinc sulfate",
      "zinc gluconate",
      "zinc acetate"
    ],
    "quality_notes_ko": "장기 고용량 복용 시 copper status 모니터링 권장."
  },
  {
    "ingredient_id": "selenium",
    "ingredient_name_ko": "셀레늄",
    "ingredient_name_en": "Selenium",
    "category": "mineral",
    "forms": [
      "selenium yeast",
      "selenite",
      "selenomethionine"
    ],
    "matching_aliases_ko": [
      "셀레늄",
      "셀레노메티오닌",
      "셀레나이트",
      "셀레늄효모"
    ],
    "matching_aliases_en": [
      "selenium",
      "selenomethionine",
      "selenite",
      "selenium yeast"
    ],
    "quality_notes_ko": "US/EU 상한값 차이 존재."
  },
  {
    "ingredient_id": "iodine",
    "ingredient_name_ko": "요오드",
    "ingredient_name_en": "Iodine",
    "category": "mineral",
    "forms": [
      "potassium iodide",
      "iodine"
    ],
    "matching_aliases_ko": [
      "요오드",
      "아이오딘",
      "요오드화칼륨",
      "요오드화포타슘"
    ],
    "matching_aliases_en": [
      "iodine",
      "potassium iodide"
    ],
    "quality_notes_ko": "갑상선질환/자가면역 상태와 함께 해석 필요."
  },
  {
    "ingredient_id": "niacin",
    "ingredient_name_ko": "니아신",
    "ingredient_name_en": "Niacin",
    "category": "vitamin",
    "forms": [
      "nicotinic acid",
      "nicotinamide",
      "niacinamide",
      "inositol hexanicotinate"
    ],
    "matching_aliases_ko": [
      "니아신",
      "니코틴산",
      "니코틴아마이드",
      "나이아신",
      "이노시톨헥사니코티네이트"
    ],
    "matching_aliases_en": [
      "niacin",
      "nicotinic acid",
      "nicotinamide",
      "niacinamide",
      "inositol hexanicotinate"
    ],
    "quality_notes_ko": "UL은 supplemental niacin에 적용."
  },
  {
    "ingredient_id": "vitamin_b6",
    "ingredient_name_ko": "비타민 B6",
    "ingredient_name_en": "Vitamin B6",
    "category": "vitamin",
    "forms": [
      "pyridoxine",
      "PLP",
      "pyridoxal phosphate"
    ],
    "matching_aliases_ko": [
      "비타민B6",
      "피리독신",
      "PLP",
      "피리독살인산"
    ],
    "matching_aliases_en": [
      "vitamin b6",
      "pyridoxine",
      "plp",
      "pyridoxal phosphate"
    ],
    "quality_notes_ko": "US/EU 상한값 차이가 큼."
  },
  {
    "ingredient_id": "st_johns_wort",
    "ingredient_name_ko": "세인트존스워트",
    "ingredient_name_en": "St. John's wort",
    "category": "herb",
    "forms": [
      "Hypericum perforatum"
    ],
    "matching_aliases_ko": [
      "세인트존스워트",
      "성요한풀",
      "하이페리컴"
    ],
    "matching_aliases_en": [
      "st john's wort",
      "hypericum",
      "hypericum perforatum"
    ],
    "quality_notes_ko": "약물상호작용이 핵심 리스크."
  },
  {
    "ingredient_id": "red_yeast_rice",
    "ingredient_name_ko": "홍국",
    "ingredient_name_en": "Red yeast rice",
    "category": "fermented_ingredient",
    "forms": [
      "Monascus purpureus",
      "monacolin K"
    ],
    "matching_aliases_ko": [
      "홍국",
      "레드이스트라이스",
      "모나콜린K"
    ],
    "matching_aliases_en": [
      "red yeast rice",
      "monacolin k",
      "lovastatin-like"
    ],
    "quality_notes_ko": "제품별 monacolin K 함량 편차와 citrinin 오염 가능성 고려."
  },
  {
    "ingredient_id": "green_tea_extract",
    "ingredient_name_ko": "녹차추출물",
    "ingredient_name_en": "Green tea extract",
    "category": "plant_extract",
    "forms": [
      "green tea extract",
      "catechins",
      "EGCG"
    ],
    "matching_aliases_ko": [
      "녹차추출물",
      "카테킨",
      "EGCG",
      "녹차카테킨"
    ],
    "matching_aliases_en": [
      "green tea extract",
      "catechins",
      "egcg"
    ],
    "quality_notes_ko": "음료형 녹차와 고농축 추출물 보충제를 구분 권장."
  },
  {
    "ingredient_id": "melatonin",
    "ingredient_name_ko": "멜라토닌",
    "ingredient_name_en": "Melatonin",
    "category": "hormone_like_supplement",
    "forms": [
      "melatonin"
    ],
    "matching_aliases_ko": [
      "멜라토닌"
    ],
    "matching_aliases_en": [
      "melatonin"
    ],
    "quality_notes_ko": "국가별 규제상태 차이 크고 제품 함량 편차 이슈 있음."
  },
  {
    "ingredient_id": "probiotics",
    "ingredient_name_ko": "프로바이오틱스",
    "ingredient_name_en": "Probiotics",
    "category": "microbial_supplement",
    "forms": [
      "Lactobacillus",
      "Bifidobacterium",
      "Saccharomyces boulardii"
    ],
    "matching_aliases_ko": [
      "프로바이오틱스",
      "유산균",
      "락토바실러스",
      "비피도박테리움",
      "사카로마이세스"
    ],
    "matching_aliases_en": [
      "probiotics",
      "lactobacillus",
      "bifidobacterium",
      "saccharomyces boulardii"
    ],
    "quality_notes_ko": "균주(strain) 단위로 세분화 가능하게 설계 권장."
  },
  {
    "ingredient_id": "ashwagandha",
    "ingredient_name_ko": "아슈와간다",
    "ingredient_name_en": "Ashwagandha",
    "category": "herb",
    "forms": [
      "Withania somnifera"
    ],
    "matching_aliases_ko": [
      "아슈와간다",
      "위타니아",